{
  "name": "Example Ancient Corpus",
  "slug": "Example-Corpus",
  "language_or_script": "replace-me",
  "record_profile": "source_attributed_inscription_reading",
  "source_policy": {
    "attribution_required": true,
    "rights_review_required": true,
    "redistribute_only_if_permitted": true
  },
  "interoperability": {
    "contract": "hawkinsnick-epigraphic-corpus-interoperability",
    "version": "1.1.0"
  }
}
